{
  "$schema": "http://json-schema.org/draft-07/schema#",
  "$id": "schema/analytics.schema.json",
  "title": "Analytics event taxonomy",
  "description": "Shape contract for shared/data/analytics.json. Generated by tools/studio/gen-schemas.mjs — edit the generator, not this file.",
  "type": "object",
  "required": [
    "commonParams",
    "dashboards",
    "events",
    "funnel",
    "kpis",
    "piiPolicy",
    "provider",
    "version"
  ],
  "additionalProperties": false,
  "properties": {
    "$schema": {
      "type": "string"
    },
    "_comment": {
      "type": "string"
    },
    "commonParams": {
      "type": "object",
      "properties": {
        "ab_test_id": {
          "type": "string"
        },
        "app_version": {
          "type": "string"
        },
        "content_version": {
          "type": "string"
        },
        "quality_level": {
          "type": "string"
        },
        "session_id": {
          "type": "string"
        }
      },
      "required": [
        "ab_test_id",
        "app_version",
        "content_version",
        "quality_level",
        "session_id"
      ]
    },
    "dashboards": {
      "type": "array",
      "items": {
        "type": "object",
        "properties": {
          "id": {
            "type": "string",
            "pattern": "^[a-z][a-z0-9_]*$"
          },
          "widgets": {
            "type": "array",
            "items": {
              "type": "string"
            }
          }
        },
        "required": [
          "id",
          "widgets"
        ]
      }
    },
    "events": {
      "type": "array",
      "items": {
        "type": "object",
        "properties": {
          "name": {
            "type": "string"
          },
          "params": {
            "type": "object",
            "properties": {
              "all_complete": {
                "type": "string"
              },
              "amount": {
                "type": "string"
              },
              "avg_fps": {
                "type": "string"
              },
              "balance": {
                "type": "string"
              },
              "best_combo": {
                "type": "string"
              },
              "burned_count": {
                "type": "string"
              },
              "category": {
                "type": "string"
              },
              "coins": {
                "type": "string"
              },
              "coins_earned": {
                "type": "string"
              },
              "coins_earned_session": {
                "type": "string"
              },
              "coins_spent_session": {
                "type": "string"
              },
              "combo": {
                "enum": [
                  "long"
                ]
              },
              "context": {
                "type": "string"
              },
              "cost_coins": {
                "type": "string"
              },
              "currency": {
                "type": "string"
              },
              "currency_code": {
                "type": "string"
              },
              "customer_id": {
                "type": "string"
              },
              "customer_type": {
                "type": "string"
              },
              "day_index": {
                "type": "string"
              },
              "days_since_install": {
                "type": "string"
              },
              "device_tier": {
                "type": "string"
              },
              "difficulty": {
                "type": "string"
              },
              "doneness": {
                "type": "string"
              },
              "doubled_by_ad": {
                "type": "string"
              },
              "draw_calls": {
                "type": "string"
              },
              "duration_ms": {
                "type": "string"
              },
              "ecpm_micros": {
                "type": "string"
              },
              "elapsed_ms": {
                "type": "string"
              },
              "embers": {
                "type": "string"
              },
              "entry_id": {
                "type": "string"
              },
              "error": {
                "type": "string"
              },
              "error_type": {
                "type": "string"
              },
              "evenness": {
                "type": "string"
              },
              "event_id": {
                "type": "string"
              },
              "event_type": {
                "type": "string"
              },
              "ingredient": {
                "type": "string"
              },
              "is_returning": {
                "type": "string"
              },
              "item_count": {
                "type": "string"
              },
              "items_missing": {
                "type": "string"
              },
              "kind": {
                "type": "string"
              },
              "last_fail_streak": {
                "type": "string"
              },
              "level": {
                "enum": [
                  "long"
                ]
              },
              "level_id": {
                "type": "string"
              },
              "locale": {
                "type": "string"
              },
              "lost_customers": {
                "type": "string"
              },
              "mem_mb": {
                "type": "string"
              },
              "milestone": {
                "type": "string"
              },
              "misses": {
                "type": "string"
              },
              "mission_id": {
                "type": "string"
              },
              "network": {
                "type": "string"
              },
              "offline_minutes": {
                "type": "string"
              },
              "p1_fps": {
                "type": "string"
              },
              "perfect_count": {
                "type": "string"
              },
              "placement": {
                "enum": [
                  "string"
                ]
              },
              "price_micros": {
                "type": "string"
              },
              "product_id": {
                "enum": [
                  "string"
                ]
              },
              "progress": {
                "type": "string"
              },
              "progress_pct": {
                "type": "string"
              },
              "quality": {
                "type": "string"
              },
              "rarity": {
                "type": "string"
              },
              "reason": {
                "enum": [
                  "string"
                ]
              },
              "restaurant_id": {
                "type": "string"
              },
              "restaurant_index": {
                "enum": [
                  "long"
                ]
              },
              "restored_count": {
                "type": "string"
              },
              "reward_id": {
                "type": "string"
              },
              "score": {
                "type": "string"
              },
              "session_index": {
                "type": "string"
              },
              "session_length_ms": {
                "type": "string"
              },
              "setting": {
                "type": "string"
              },
              "signal": {
                "type": "string"
              },
              "sink": {
                "type": "string"
              },
              "source": {
                "enum": [
                  "string"
                ]
              },
              "step": {
                "type": "string"
              },
              "step_index": {
                "type": "string"
              },
              "streak": {
                "type": "string"
              },
              "tier": {
                "type": "string"
              },
              "time_on_grill_s": {
                "type": "string"
              },
              "track": {
                "type": "string"
              },
              "track_id": {
                "type": "string"
              },
              "turns": {
                "type": "string"
              },
              "turns_played": {
                "type": "string"
              },
              "turns_since_last": {
                "type": "string"
              },
              "value": {
                "type": "string"
              },
              "variant": {
                "type": "string"
              },
              "wait_pct": {
                "type": "string"
              },
              "xp": {
                "type": "string"
              },
              "zone": {
                "type": "string"
              }
            }
          },
          "trigger": {
            "type": "string"
          }
        },
        "required": [
          "name",
          "params",
          "trigger"
        ]
      },
      "minItems": 40,
      "description": "§8 content floor: at least 40 entries."
    },
    "funnel": {
      "type": "array",
      "items": {
        "type": "object",
        "properties": {
          "event": {
            "type": "string"
          },
          "filter": {
            "type": "string"
          },
          "id": {
            "type": "string",
            "pattern": "^[a-z][a-z0-9_]*$"
          }
        },
        "required": [
          "event",
          "id"
        ]
      }
    },
    "kpis": {
      "type": "array",
      "items": {
        "type": "string"
      }
    },
    "piiPolicy": {
      "type": "object",
      "properties": {
        "forbiddenParamSubstrings": {
          "type": "array",
          "items": {
            "type": "string"
          }
        },
        "forbiddenParams": {
          "type": "array",
          "items": {
            "type": "string"
          }
        },
        "userIdAllowed": {
          "type": "string"
        }
      },
      "required": [
        "forbiddenParamSubstrings",
        "forbiddenParams",
        "userIdAllowed"
      ]
    },
    "provider": {
      "type": "string"
    },
    "version": {
      "type": "integer"
    }
  }
}
